{
  "log": {
    "level": "warn"
  },
  "experimental": {
    "clash_api": {
      "external_controller": "127.0.0.1:9090",
      "secret": "test-secret"
    }
  },
  "inbounds": [
    {
      "type": "socks",
      "tag": "socks-in",
      "listen": "127.0.0.1",
      "listen_port": 11801
    }
  ],
  "outbounds": [
    {
      "type": "vmess",
      "tag": "vmess-ok",
      "server": "127.0.0.1",
      "server_port": 12084,
      "uuid": "00000000-0000-0000-0000-000000000002",
      "security": "aes-128-gcm"
    },
    {
      "type": "vmess",
      "tag": "vmess-bad",
      "server": "127.0.0.1",
      "server_port": 12084,
      "uuid": "00000000-0000-0000-0000-000000000099",
      "security": "aes-128-gcm"
    },
    {
      "type": "direct",
      "tag": "direct"
    }
  ],
  "route": {
    "rules": [
      {
        "port": [
          18112
        ],
        "outbound": "vmess-bad"
      },
      {
        "port": [
          18111
        ],
        "outbound": "vmess-ok"
      }
    ],
    "final": "direct"
  }
}
