{
  "log": {
    "level": "warn"
  },
  "inbounds": [
    {
      "type": "socks",
      "name": "socks-in",
      "listen": "127.0.0.1",
      "port": 11810
    }
  ],
  "outbounds": [
    {
      "type": "direct",
      "name": "direct"
    }
  ],
  "route": {
    "rules": [],
    "final": "direct"
  }
}
