{
  "log": {
    "level": "warn"
  },
  "experimental": {
    "clash_api": {
      "external_controller": "127.0.0.1:9090",
      "secret": "test-secret"
    }
  },
  "inbounds": [
    {
      "type": "socks",
      "tag": "socks-in",
      "listen": "127.0.0.1",
      "listen_port": 11801
    }
  ],
  "outbounds": [
    {
      "type": "block",
      "tag": "block"
    }
  ],
  "route": {
    "rules": [],
    "final": "block"
  }
}
