{
  "log": { "level": "info" },
  "experimental": {
    "clash_api": {
      "external_controller": "127.0.0.1:19290",
      "secret": "test-secret"
    }
  },
  "inbounds": [
    { "type": "socks", "name": "socks-v4", "listen": "127.0.0.1:11801" },
    { "type": "socks", "name": "socks-v6", "listen": "[::1]:11802" }
  ],
  "outbounds": [
    { "type": "direct", "name": "direct" },
    { "type": "block", "name": "block" }
  ],
  "route": {
    "rules": [
      {
        "rule_set": ["source-ipv4"],
        "rule_set_ip_cidr_match_source": true,
        "outbound": "direct"
      },
      { "port": ["18898"], "outbound": "direct" }
    ],
    "rule_set": [
      {
        "tag": "source-ipv4",
        "type": "local",
        "format": "source",
        "path": "labs/interop-lab/fixtures/routing/source_ipv4.json"
      }
    ],
    "final": "block"
  }
}
