{
  "log": {
    "level": "warn"
  },
  "inbounds": [
    {
      "type": "socks",
      "tag": "socks-in",
      "listen": "127.0.0.1",
      "listen_port": 11802
    }
  ],
  "outbounds": [
    {
      "type": "vmess",
      "tag": "vmess-ok",
      "server": "127.0.0.1",
      "server_port": 12085,
      "uuid": "00000000-0000-0000-0000-000000000002",
      "security": "auto",
      "tls": {
        "enabled": true,
        "server_name": "anytls.local",
        "alpn": [
          "h2"
        ],
        "min_version": "1.3",
        "max_version": "1.3",
        "certificate_path": "vendor/anytls-rs/examples/singbox/certs/anytls.local.crt.fixture"
      }
    },
    {
      "type": "vmess",
      "tag": "vmess-bad-uuid",
      "server": "127.0.0.1",
      "server_port": 12085,
      "uuid": "00000000-0000-0000-0000-000000000099",
      "security": "auto",
      "tls": {
        "enabled": true,
        "server_name": "anytls.local",
        "alpn": [
          "h2"
        ],
        "min_version": "1.3",
        "max_version": "1.3",
        "certificate_path": "vendor/anytls-rs/examples/singbox/certs/anytls.local.crt.fixture"
      }
    },
    {
      "type": "vmess",
      "tag": "vmess-bad-sni",
      "server": "127.0.0.1",
      "server_port": 12085,
      "uuid": "00000000-0000-0000-0000-000000000002",
      "security": "auto",
      "tls": {
        "enabled": true,
        "server_name": "wrong.invalid",
        "alpn": [
          "h2"
        ],
        "min_version": "1.3",
        "max_version": "1.3",
        "certificate_path": "vendor/anytls-rs/examples/singbox/certs/anytls.local.crt.fixture"
      }
    }
  ],
  "route": {
    "rules": [
      {
        "port": [
          18114
        ],
        "outbound": "vmess-bad-uuid"
      },
      {
        "port": [
          18115
        ],
        "outbound": "vmess-bad-sni"
      }
    ],
    "final": "vmess-ok"
  }
}
